question,a,b,c,d,correct
"Who founded the company?","Sarah Chen","Mark Davis","Lisa Park","Tom Wright",A
"What year did we launch our first product?","2017","2018","2019","2020",C
"Which city was our first office?","London","New York","Berlin","Singapore",A
"How many employees do we have globally?","500","1000","2500","5000",B
"What is our company's core value?","Speed","Innovation","Integrity","Collaboration",C
"Which market did we enter first?","Europe","Asia Pacific","North America","Latin America",C
"What was our revenue growth last year?","15%","22%","31%","40%",B
